{
  "schema_version": "1.0",
  "source_id": "fin_data_mcp_render_prod",
  "provider": "OKX",
  "scope": "institutional_crypto_market_data_for_fund_research_and_ai_processing",
  "status": "BLOCKED_PENDING_RIGHTS_CONFIRMATION",
  "reason": "The published OKX API Agreement restricts Market Data use; no jurisdiction-specific fund authorization or written license is recorded.",
  "evidence": [
    {
      "uri": "https://github.com/CohenD/fin-data-mcp",
      "description": "Upstream provider documentation identifies OKX as the crypto data backend.",
      "observed_at": "2026-09-30T04:20:00Z"
    },
    {
      "uri": "https://www.okx.com/en-ae/help/okx-api-agreement?j2ke8=9",
      "description": "Published API Agreement reviewed; Sections 3.2(a), 9.2-9.4 address public market data and use restrictions. UAE-localized text; applicability to the fund entity/jurisdiction is unverified.",
      "observed_at": "2026-09-30T04:20:00Z"
    }
  ],
  "required_evidence_to_authorize": [
    "jurisdiction_and_contracting_entity_review",
    "written_provider_license_or_authorization_covering_institutional_fund_research",
    "written_scope_for_durable_storage_and_AI_processing"
  ],
  "authorization_decision": null
}
